Website Name,Excel Name,Match Score,Excel Class,Current Class
MUHAMMAD YUSUF BIN ABDULLAH,No Match,0,ALUMNI,5 RUBY
NAZATUL AKMA BINTI ABDULLAH,No Match,0,ALUMNI,5 RUBY
MUHAMMAD QHAIRUL ZAFUAN BIN ABDULLAH,No Match,0,ALUMNI,5 RUBY
AHMAD IRFAN BIN AHMAD TARMIZI,No Match,0,ALUMNI,5 RUBY
NURAINI ALIA BINTI NORDIN,No Match,0,ALUMNI,5 RUBY
ZARYN NUR AMEENA BINTI MOHD ZAKI,No Match,0,ALUMNI,5 RUBY
MUHAMMAD NAQIE IRFAN BIN SAHRIL,No Match,0,ALUMNI,5 RUBY
MUHAMMAD HAZIQ IMAN BIN SAIFULHADI,No Match,0,ALUMNI,5 RUBY
